gate_name,fields_detected,rows_detected,scenarios_affected,models_affected,median_rel_error,max_rel_error,easy_description,why_it_might_be_useful,false_positive_risk,recommended_next_action
SIGN_FLIP_GATE,6,6,1,6,1.99888299788,1.99957618524,The magnitude is similar but the sign is wrong.,Large numeric misses are often easier to review with this gate-specific cue.,medium,manual_audit_before_formalizing
POWER_OF_TEN_SCALE_GATE,16,12,9,6,9.00282051279,98.9771699988,The answer looks shifted by decimal or scientific-notation scale.,Large numeric misses are often easier to review with this gate-specific cue.,medium,manual_audit_before_formalizing
WRONG_FIELD_SCALE_GATE,5,5,5,4,5.51046483239,414.201514742,The answer looks closer to another field's expected value than to its own.,Large numeric misses are often easier to review with this gate-specific cue.,medium,manual_audit_before_formalizing
ORDER_OF_MAGNITUDE_GATE,50,33,15,7,98.9749131778,2635088802.47,The answer is at least 10 times too large or too small.,Large numeric misses are often easier to review with this gate-specific cue.,low,manual_audit_before_formalizing
EXTREME_EXPLOSION_GATE,48,31,13,6,186.117214464,2635088802.47,The answer is more than 1000% away from gold.,Large numeric misses are often easier to review with this gate-specific cue.,low,manual_audit_before_formalizing
UNCLASSIFIED_LARGE_GATE,24,17,14,7,3.09248707032,8.16505227308,The answer is more than 100% wrong but did not match a simple ratio heuristic.,This bucket catches large misses that need human inspection before a gate exists.,medium,inspect_for_new_gate_patterns
